<?xml version="1.0" encoding="UTF-8" standalone="no"?><lista xmlns:xs="http://www.w3.org/2001/XMLSchema" xs:schemaLocation="havaintolista.xsd"><laji><nimi>käpytikka</nimi><havainnot><havainto><paikka>lappeenranta, skinnarila</paikka><pvm>2014-03-02</pvm><lkm>1</lkm></havainto><havainto><paikka>paloheinä</paikka><pvm>2014-03-30</pvm><lkm>1</lkm></havainto></havainnot></laji><laji><nimi>lapinpöllö</nimi><havainnot><havainto><paikka>helsinki, laajasalo</paikka><pvm>2013-04-29</pvm><lkm>1</lkm></havainto><havainto><paikka>helsinki, kannelmäki</paikka><pvm>2013-04-30</pvm><lkm>1</lkm></havainto></havainnot></laji><laji><nimi>merikotka</nimi><havainnot><havainto><paikka>brändö</paikka><pvm>2014-04-12</pvm><lkm>1</lkm></havainto></havainnot></laji><laji><nimi>niittysuohaukka</nimi><havainnot><havainto><paikka>espoo, matalajärvi</paikka><pvm>2013-06-30</pvm><lkm>1</lkm></havainto></havainnot></laji><laji><nimi>ruskosuohaukka</nimi><havainnot><havainto><paikka>rauman maalaiskunta</paikka><pvm>2013-06-20</pvm><lkm>1</lkm></havainto></havainnot></laji><laji><nimi>sinisorsa</nimi><havainnot><havainto><paikka>tokoinranta</paikka><pvm>2013-04-30</pvm><lkm>15</lkm></havainto><havainto><paikka>tokoinranta</paikka><pvm>2014-04-30</pvm><lkm>5</lkm></havainto></havainnot></laji><laji><nimi>talitiainen</nimi><havainnot><havainto><paikka>tuupovaara</paikka><pvm>2012-06-12</pvm><lkm>1</lkm></havainto><havainto><paikka>helsinki, kaisaniemi</paikka><pvm>2013-07-12</pvm><lkm>1</lkm></havainto></havainnot></laji><laji><nimi>varis</nimi><havainnot><havainto><paikka>helsinki, malmi</paikka><pvm>2014-04-12</pvm><lkm>4</lkm></havainto></havainnot></laji><laji><nimi>västäräkki</nimi><havainnot><havainto><paikka>sipoo, landbo</paikka><pvm>2014-03-10</pvm><lkm>2</lkm></havainto></havainnot></laji></lista>