<?xml version="1.0" encoding="UTF-8" standalone="no"?><lista xmlns:xs="http://www.w3.org/2001/XMLSchema" xs:noNamespaceSchemaLocation="havaintolista.xsd"><laji>hippiäinen<havainnot><havainto><paikka>sipoo</paikka><pvm>2014-04-24</pvm><lkm>1</lkm></havainto></havainnot></laji><laji>merikotka<havainnot><havainto><paikka>brändö</paikka><pvm>2014-04-29</pvm><lkm>1</lkm></havainto></havainnot></laji><laji>sinisorsa<havainnot><havainto><paikka>tokoinranta</paikka><pvm>2014-04-29</pvm><lkm>4</lkm></havainto></havainnot></laji></lista>