<?xml version="1.0" encoding="UTF-8" standalone="no"?><lista xmlns:xs="http://www.w3.org/2001/XMLSchema" xs:schemaLocation="havaintolista.xsd"><laji><nimi>käpytikka</nimi><havainnot><havainto><paikka>helsinki</paikka><pvm>2014-05-15</pvm><lkm>1</lkm></havainto></havainnot></laji><laji><nimi>lapinpöllö</nimi><havainnot><havainto><paikka>kannelmäki</paikka><pvm>2013-05-15</pvm><lkm>1</lkm></havainto></havainnot></laji><laji><nimi>merikotka</nimi><havainnot><havainto><paikka>brändö</paikka><pvm>2014-04-12</pvm><lkm>1</lkm></havainto></havainnot></laji><laji><nimi>niittysuohaukka</nimi><havainnot><havainto><paikka>sipoo</paikka><pvm>2013-08-15</pvm><lkm>1</lkm></havainto></havainnot></laji><laji><nimi>ruskosuohaukka</nimi><havainnot><havainto><paikka>rauma</paikka><pvm>2013-06-15</pvm><lkm>1</lkm></havainto></havainnot></laji><laji><nimi>sinisorsa</nimi><havainnot><havainto><paikka>helsinki</paikka><pvm>2012-02-15</pvm><lkm>14</lkm></havainto></havainnot></laji><laji><nimi>talitiainen</nimi><havainnot><havainto><paikka>helsinki</paikka><pvm>2013-04-12</pvm><lkm>1</lkm></havainto></havainnot></laji><laji><nimi>varis</nimi><havainnot><havainto><paikka>helsinki</paikka><pvm>2014-05-15</pvm><lkm>3</lkm></havainto></havainnot></laji><laji><nimi>västäräkki</nimi><havainnot><havainto><paikka>helsinki</paikka><pvm>2014-05-15</pvm><lkm>1</lkm></havainto></havainnot></laji></lista>